{
  "$schema": "./system-v3.schema.json",
  "contract_id": "dynamisdata-matchlab-rendering",
  "version": "3.0.0",
  "status": "frozen",
  "scope": "MatchLab Field, Pose, shared context, renderer and frame-preparation boundary only. System V2 remains authoritative outside this boundary.",
  "authorities": {
    "scientific": "Accepted source artifacts and versioned Python processor outputs own values, methods, units, measurement classes and scientific interpretation.",
    "provenance_rights": "Existing RES-109 registry, checksum, processing lineage and rights gates remain authoritative and are never bypassed by a renderer.",
    "server_data": "TanStack Query owns bounded API windows, artifacts, source metadata and cache lifecycle.",
    "transient_state": "Zustand owns the live playhead, playback, hover and transient interaction state; the router owns durable deep-link context.",
    "frame_rendering": "The existing Arrow/Comlink worker prepares typed frame buffers; Three refs and GPU buffers own presentation at frame cadence."
  },
  "technology": {
    "engine": "Three.js",
    "react_binding": "React Three Fiber",
    "helpers": "Drei",
    "canvas_count": 1,
    "multi_view": "Drei View scissor rendering shares one Canvas, renderer, scene resources and GPU context.",
    "initial_backend": "WebGL2",
    "webgpu_gate": "Benchmark Three WebGPURenderer only after the final representative MatchLab scene, required TSL materials and WebGL2 baseline exist; WebGPU adoption requires target-browser compatibility and measured benefit.",
    "prohibited": ["Babylon", "Unity", "deck.gl", "a second live 3D engine", "a second production Field renderer"]
  },
  "state_ownership": {
    "durable_context": "TanStack Router owns dataset, session/match, period/trial, canonical t_ns, selected player and view mode for reproducible deep links.",
    "server_data": "TanStack Query owns source metadata, rights-filtered artifacts, exact bounded frame windows and tactical processor outputs.",
    "transient_interaction": "Zustand owns the live canonical playhead, playback status/rate, hover, selected tactical object and renderer interaction.",
    "frame_cadence": "The Arrow/Comlink worker owns preparation; Three refs and typed buffers own per-frame visual mutation without React row-object rebuilding.",
    "context_role": "MatchFrameContext is the sole renderer-facing snapshot and action API composed from the existing owners; it creates no duplicate store or selection authority."
  },
  "match_frame_context": {
    "owns": ["dataset_id", "session_id and match identity", "period/trial identity", "canonical t_ns", "selected and hovered player", "selected team", "selected tactical object", "tracking frame identity and availability", "pose frame identity and availability", "per-source measurement class and quality"],
    "canonical_time": "Signed BigInt nanoseconds stay exact through context, routing and worker handoff; conversion to renderer units occurs only at the display boundary. Source frame resolution is independent and never uses frame-index equality.",
    "player_identity": "A registered session participant subject_id is the canonical player identity. For SkillCorner it exactly matches tracking subject_id/object_id and Pose subject_id. Other sources need an explicit registered identity mapping; coordinates and proximity never establish identity.",
    "tracking_resolution": "Resolve the latest real tracking frame at or before canonical t_ns only when its age is at most 1.5 nominal sample intervals; preserve its exact source timestamp, is_detected, extrapolation and gaps.",
    "pose_resolution": "Resolve the latest real Pose sample at or before canonical t_ns only when its age is at most 1.5 nominal sample intervals. Preserve its exact source timestamp; otherwise report absence and the previous/next observed time without changing player or playhead. Never interpolate.",
    "deep_link": ["dataset_id", "session_id", "period/trial_id", "subject_id", "t_ns", "MatchLab view mode"]
  },
  "pitch": {
    "geometry_source": "Positive length_m and width_m in metres from structured, registered source match metadata attached to the selected tracking stream and coordinate frame.",
    "missing_geometry": "Show unavailable geometry and its source; never infer dimensions from observed coordinate extents or substitute a decorative/default pitch.",
    "coordinate_frame": "Tracking X/Y retain the registered pitch-centred source frame. Pitch3D markings use the same metric dimensions and do not transform observations.",
    "markings": "Generate standardized IFAB markings procedurally and goals from field dimensions; optional context decoration cannot affect analytical clarity."
  },
  "layers": [
    { "id": "PitchLayer", "responsibility": "Registered metric pitch and goals.", "independently_toggleable": true },
    { "id": "TrackingLayer", "responsibility": "Tracked entities, ball, provider state, trails and player picking.", "independently_toggleable": true },
    { "id": "TacticalLayer", "responsibility": "Processor-produced team/unit geometry, graphs, territory, scalar fields, events and paths.", "independently_toggleable": true },
    { "id": "PoseLayer", "responsibility": "Provider landmarks/topology, processor-declared analytical overlays, error radii and joint picking.", "independently_toggleable": true },
    { "id": "ContextLayer", "responsibility": "Selection identity, labels, source alignment evidence, and explicit source/display-mode badges.", "independently_toggleable": true }
  ],
  "source_alignment": [
    { "mode": "source_native", "rule": "Draw tracking and Pose from their separate source coordinates and preserve their distinct frames.", "scientific_input_eligible": true },
    { "mode": "tracking_anchored_display", "rule": "Translate the Pose root/centroid to tracking XY for presentation only; no scale, rotation or downstream scientific use.", "scientific_input_eligible": false },
    { "mode": "display_grounded_vertical", "rule": "Translate the selected Pose foot/contact minimum to rendered pitch level while preserving relative geometry; Z remains centroid-relative.", "scientific_input_eligible": false }
  ],
  "worker_data_plane": {
    "transport": "Existing Arrow JS, Web Worker and Comlink boundary with transferable ArrayBuffers and typed arrays.",
    "components": ["canonical tracking frames", "Pose landmarks and masks", "tactical polygons and graphs", "scalar-grid values", "frame and source availability metadata"],
    "prepared_outputs": ["BigInt64Array canonical times", "integer identity dictionaries", "Float32Array positions and errors", "Uint8Array detection/availability masks", "typed geometry offsets and scalar grids"],
    "ownership": "Worker decodes and prepares; main thread mutates Three buffers, cameras and interaction state; TanStack Query and PlaybackChunkCoordinator retain request/cache ownership.",
    "rule": "Do not build per-row object maps at animation-frame cadence, interpolate missing scientific samples or discard contract metadata."
  },
  "scalar_fields": {
    "input": ["bounded processor-produced grid", "declared metric id and method/model identity", "fixed semantic domain", "units", "measurement class", "source coordinate frame"],
    "gpu_representation": ["typed buffer or DataTexture", "flat heatmap", "contour", "optional analytical elevation"],
    "color_domain": "Fixed and declared for the selected metric; never autoscaled frame by frame.",
    "metric_authority": "Scientific processors compute values; shaders only map supplied values to a declared visual encoding.",
    "elevation": "Always label analytical elevation as NOT PHYSICAL PITCH HEIGHT; never imply it is a measured surface."
  },
  "interaction": {
    "selection_authority": "One MatchFrameContext selection action. Field-origin player picks commit the player and current canonical time without moving it when Pose is absent; the Pose view reports absence and the next sample. Pose-origin player switches retain RES-109 section 12 by resolving the first valid observation in the active range. Both commit player and target time together through the durable router context.",
    "identity_mapping": "Picking returns typed canonical player, Pose subject/joint, tactical-object or event identity; color alone never carries selection.",
    "absence": "Unavailable observations are explicit, never substituted with another player or fabricated at the requested time.",
    "hover": "Transient only; hover cannot change durable selection, time or scientific results.",
    "accessibility": "DOM summaries and equivalent panel actions expose the selected player, tactical object and Pose joint; keyboard selection, non-color state and reduced-motion camera behavior remain available."
  },
  "migration": {
    "entry_sha": "ae0164c68e44ebec64360a4475c250f4def86311",
    "single_worktree": true,
    "atomic_commits": true,
    "steps": [
      { "id": 1, "gate": "Freeze and validate MatchLab V3 architecture, schema and ADRs before renderer implementation." },
      { "id": 2, "gate": "Establish one authoritative MatchFrameContext for match, period, canonical time, player and selection." },
      { "id": 3, "gate": "Implement bidirectional Field/Pose player selection and canonical-time contracts." },
      { "id": 4, "gate": "Build source-sized procedural Pitch3D." },
      { "id": 5, "gate": "Build reusable Tracking, Tactical, Pose and Context Three layers." },
      { "id": 6, "gate": "Prepare tracking, Pose and tactical frames in the Arrow/Comlink worker with transferable typed buffers." },
      { "id": 7, "gate": "Implement one R3F Canvas with Drei scissored multi-view support." },
      { "id": 8, "gate": "Migrate Field from Pixi to Three/R3F and retain Pixi only as a temporary parity oracle." },
      { "id": 9, "gate": "Implement the generic fixed-domain scalar-field renderer." },